{
  "decision_id": "01JB0000000000000000000000",
  "type": "orchestrator",
  "selected_action": "QUEUE",
  "agent_id": "agent-2",
  "message_id": "01JB0000000000000000000011",
  "created_at": "2026-10-30T18:00:00Z",
  "reason_codes": ["human_draft_closed"],
  "orchestrator_evidence": {
    "allowed_actions": ["QUEUE", "DEFER"],
    "guards": [
      {"guard": "human_draft_closed", "outcome": "fail"}
    ],
    "selected_action": "QUEUE",
    "policy_version": "policy-v1",
    "decision_model": "analyst-v1",
    "glimmer_call_id": "call-1",
    "execution_status": "PENDING",
    "channel_decision_id": "chd_01JB0000000000000000000000"
  }
}
