{
  "decision_id": "chd_01JB0000000000000000000000",
  "type": "channel",
  "stage": "delivery",
  "outcome": "HOLD",
  "agent_id": "agent-2",
  "message_id": "01JB0000000000000000000011",
  "created_at": "2026-10-30T18:00:00Z",
  "reason_codes": ["CONTROL_CHANGED"],
  "channel_evidence": {
    "control_versions": {
      "global:*": 3,
      "agent:agent-2": 9
    },
    "deciding_scope": "receiver"
  }
}
